Date Released,Song Title,Artist(s),Target(s),Year Released,lyrics
25-Feb-17,"""Shether""",Remy Ma,Nicki Minaj,2017,"Free Remy!
(Word)
You know what? Free Remy!
Fuck you, Free Remy!
(Fuck Nicki Minaj!)
Are you dumb?

You wore a pink diamond chicken wing chain (Are you dumb?)

You had a leopard beehive on your head (Are you dumb?)

(Fuck Nicki Minaj!)

Are you forgettin' that I pressed you before, bitch?

(Fuck Nicki Minaj!)



(I) Fuck with your soul like shETHER

(Will) You ain't the queen, I'll show you

(Not) Lipo your ass and belly

(Lose) I prove you lost already



They told you your whole career I'd come home and kill you, right? Ha-ha!

I told you I wasn't talkin' about your dumb ass

It looks stupid, you literally got a dumb ass

Talkin' cray, and we all know that you dumb as

You get Donkey of the Day, yeah, you dumb ass

Let's be honest, you stole that line 'bout bitches bein' your sonshow you take my '09 jail tweet and run?

Talkin' about bringin' knives to a fight with guns

When the only shot you ever took was in your buns

And I saw Meek at All-Star, he told me your ass dropped

He couldn't fuck you for three months

Because your ass dropped

Now I don't think y'all understand how bad her ass got

The implants that she had put in her ass popped

I was like, ""Damn, 90 days and you couldn't have box?

Did she at least compensate? Start givin' you mad top?

Her name Minaj, right? She ain't throw you some bad thots?""

He said ""Nah,"" that's when I knew you was really a trash bop

You was screamin' ""Free Remy!"" when I was upstate doomed

But now that they freed Remy, you don't sing the same tune

Locked me up, threw away my keys, threw away my weaves

Snatched me from my son, braids to the back, state greens

Daily News, ""Her career's over,"" ""She was kinda stupid,""

But you saw a opportunity 'cause you a opportunist

Left your Day 1 'cause you heard he was on some cheat shit

Then got with the dude that told you on some creep shit

But what happened to Omeeka? Nah, on some G shit

Left him and took a pic with the dude he had beef with?

And we all know it was a beef that you started

Pillow-talkin' out of your ass, this bitch retarded

Now you gotta die, you dearly departed

Bloodbath when I catch you, a real red carpet

Now what I'ma do, I'ma just stick to the facts

Bitch so scared of my future, got this bitch goin' backwards

Been through mad crews, you disloyal hoochie

Now all of a sudden you back with Drake and Tunechi?

After he said you sucked his dick, you back with Gucci?

Who next: Puff, Deb, or Fendi? You a A-list groupie

And to be the Queen of Rap, you gotta actually rap

The whole industry know that your shit is a wrap

No, to be the Queen of Rap, you can't have a ghostwriter

And that's why this is my house; Flo Rida

Niggas done seen Drake pennin', Wayne pennin'

And since your first boyfriend left, bitch ain't winnin'

You a Internet troll, a Web browser, I'm sorry

You can't get her online without Safaree

Mentionin' guns, you Pussy Galore, James Bond

Only time you touch a trigga is when you fucked Trey Songz

Coke head, you cheated on your man with Ebro

I might leak the footage of you sniffin' them ski slopes

They gassin' you up, but you been on E, though

""Pills and Potions,"" yep, you been on E, hoe

Got your ghostwriters back, so you think you lit

Rem Belushi, I'm a Ghostbuster, bitch

I'm supposed to be scared

'Cause you bought your Barbie chain back?

I'll revert to ""Ante Up,"" you'll get your Barbie chain yapped

Tried to front in February, catch you in that Maybach

Show you how to use your name, you be usin' your name wack

I'm sayin', how you mix Nicki with a Minaj?

I'ma park this bitch, put Nicki in the garage

I'm gettin' money like Nicky Barnes, I'm the big homie

I responded in less than 48 Hours; Nick Nolte

Gettin' close like Nick Jonas, grippin' the gauge

Then blaze off, Face Off, bitch, Nicolas Cage

You animated like Nickelodeon, you fake, bitch

Only the kids believe in you; you St. Nick

Now when I shoot Nick at Nite, they won't understand it

I'm Wild'n Out, 'bout to hit Nick with the Cannon

How are you on the VMAs, actin' like you hood?

Way across the stage, talkin' about ""Miley, what's good?""

That's Hannah Montana, she was always happy

You only fronted on Mariah 'cause Mariah don't carry

Tried to disrespect Taylor 'cause Taylor wasn't Swift enough

Pillsbury Doughgirl; Remy pick the biscuit up

I'm jealous? Bitch, you was happy when they took me

Best thing that ever happened to you was when they booked me

You said you never fucked Waynehow stupid I look, B?

Get the picture, I'll expose you, I'm kind of a bully

You named yourself Nicki Lewinsky, the mind of a rookie

'Cause you was suckin' his dick

And now he tired of your nookie

You claimed you never fucked Drake

Now that's where you took me

You fucked the whole Empirewho you tryin' to be, Cookie?

Boogie Down Bronx, I come out of the Boogie

To let you know real bitches never lie on their pussy

And stop talkin' numbers, you signed a 360 deal

Through Young Money, through Cash Money, through Republic

Which means your money go through five niggas before you touch it

Any videos, promotions come out of your budget

Endorsements, tour and merchandise, they finger-fuck it

You make, like, 35 cents off of each ducat

I own my masters, bitch, independent

So for every sale I do, you gotta do like ten

Stop comparin' yourself to Jay, you not like him

You a motherfuckin' worker, not a boss like Rem

You're done, them pop chicks ain't get the news yet

Bitch, I pop chicks, yeah, and I'm the new vet

I kill rappers, and you good as dead, bitch

Talkin' shit about me to a deaf bitch

And usually I have sympathy for the impaired

But not when you hard of hearin' from untreated gonorrhea

But you point your fingers at me? I'm the bad girl

When she the one out here misleadin' the black girls?

All these fake asses influenced by that girl

Dyin' from botched surgerieswhat a sad world!

But before the butt job, you was a Spongebob

Suckin' cock for records, captain of the cum squad

And I got a few words for the moms of the young Barbz

Guess who supports a child molester? Nicki Minaj

You paid for your brother's wedding? That's hella foul

How you spendin' money to support a pedophile?

He a walkin' dead man, sendin' threats to him

I guess that's why they call you Barbie, you was next to Ken

Talkin' about your money long and your foreign sick

Why you ain't help your bro hide his cum from forensics?

You probably somewhere overseas, foreign sick

Thought you could fuck with me, by far Rem sick

Meek, Drake, Safaree, I see men in your pants

We call that Jelani, get it? Semen in your pants

Uh, I got trigger fingers, you got bitter fingers

Yeah, you must think you Drake and I'm Twitter fingers

VH1, watch this

You just got bodied by a Love & Hip-Hop bitch



Don't ever in your fuckin' life play with me

That's on the set!

You tried it on the Rae Sremmurd record

You tried it on your little freestyle

They was both duds, just like every other one was duds

Just like this last one was a dud

But what you not gonna do is keep subbin' me

Big Pun!

I send a fuckin' headshot, you dead, bitch!

Will not lose!"
10-Mar-17,"""No Frauds""","Nicki Minaj, Drake, Lil Wayne",Remy Ma,2017,
19-May-17,"""Swish Swish""",Katy Perry feat Nicki Minaj,Taylor Swift and Remy Ma,2017,
24-Aug-17,"""Look What You Made Me Do""",Taylor Swift,"Kanye West, Kim Kardashian, and Katy Perry",2017,"I don't like your little games
Don't like your tilted stage
The role you made me play
Of the fool, no, I don't like you
I don't like your perfect crime

How you laugh when you lie

You said the gun was mine

Isn't cool, no, I don't like you (oh!)



But I got smarter, I got harder in the nick of time

Honey, I rose up from the dead, I do it all the time

I've got a list of names and yours is in red, underlined

I check it once, then I check it twice, oh!



Ooh, look what you made me do

Look what you made me do

Look what you just made me do

Look what you just made me, ooh

Look what you made me do

Look what you made me do

Look what you just made me do

Look what you just made me do



I don't like your kingdom keys

They once belonged to me

You asked me for a place to sleep

Locked me out and threw a feast (what?)



The world moves on, another day, another drama, drama

But not for me, not for me, all I think about is karma

And then the world moves on, but one thing's for sure

Maybe I got mine, but you'll all get yours



But I got smarter, I got harder in the nick of time

Honey, I rose up from the dead, I do it all the time

I've got a list of names and yours is in red, underlined

I check it once, then I check it twice, oh!



Ooh, look what you made me do

Look what you made me do

Look what you just made me do

Look what you just made me, ooh

Look what you made me do

Look what you made me do

Look what you just made me do

Look what you just made me do



I don't trust nobody and nobody trusts me

I'll be the actress starring in your bad dreams

I don't trust nobody and nobody trusts me

I'll be the actress starring in your bad dreams

I don't trust nobody and nobody trusts me

I'll be the actress starring in your bad dreams

I don't trust nobody and nobody trusts me

I'll be the actress starring in your bad dreams



(Look what you made me do...)



""I'm sorry, the old Taylor can't come to the phone right now.""

""Why?""

""Oh, 'cause she's dead!"" (ohh!)



Ooh, look what you made me do

Look what you made me do

Look what you just made me do

Look what you just made me, ooh

Look what you made me do

Look what you made me do

Look what you just made me do

Look what you just made me do



Ooh, look what you made me do

Look what you made me do

Look what you just made me do

Look what you just made me, ooh

Look what you made me do

Look what you made me do

Look what you just made me do

Look what you just made me do"
1-Sep-17,"""How Do You Sleep?""",LCD Soundsystem,Tim Goldsworthy,2017,"Standing on the shore, facing east
I can't feel you
Standing on the shore, facing east
Your impermanence
You're taking water

Listing lazily out of view



I remember when we were friends

I remember calling you friend



Standing on the shore my ear aimed east

I can't hear you

I can't hear you anymore

I can't hear you

I can't hear you anymore



I still remember

Laughing and fighting

I still remember



Standing on the shore, watching for you

You're painted into a corner

Whatever fits in your pockets; you'll get your due

Just like before

With all the others



You warned me about the cocaine

Then dove straight in

Yeah, you warned me about the cocaine

Then dove straight in



In hiding, where there's more for you

There's more for you

There's more for you

There's more for you

There's more for you

There's more for you

There's more for you

There's more for you

There's more for you

There's more for you

There's more for you

There's more for you

There's more for you

There's more for you

There's more for you

There's more for you

There's more for you

There's more for you

There's more for you

There's more for you



Standing on the shore, getting off

You left me here amid the vape clouds

I must admit I missed the mountain

But not so much you



One step forward

One step forward

One step forward

And six steps back

And six steps back

And six steps back

And six steps back

And six steps back

And six steps back

And six steps back

And six steps back



Standing on the floor, facing you

I can't see you, your impermanence

This place is empty

Empty of you



And if I see you, it's like nothing went wrong

Yeah, if we meet again tomorrow, just like nothing went wrong But there I go



Erasing our chances

Just by asking

""How do you sleep?""



One step forward

One step forward

One step forward

And six steps back

And six steps back

And six steps back

And six steps back

And six steps back

And six steps back

And six steps back

And six steps back"
22-Dec-17,"""Piggyback""",Melanie Martinez,Timothy Heller,2017,"I was three years old
All I wanted was the music and
My parents were doing everything they could
To move away from our place working over time always
While I sat up in my grandma's project building coloring, oh

Moved to a small town and started to, started to grow

Poetry written, I'm singing and dancing, oh

Photographs, painting, cartoons

That's all I know

That's all I know, oh



I have one best friend to this very fucking day

Since we were five years old and I fucking moved away

I wish I never did cause she's the only one who sees me

For who I really am instead of how many I reach, oh



Trusted too many fake people while I was still young

Gave them the benefit of the doubt, I was so wrong

I cut them off and they came for blood cause they know

They ain't getting no more



I'm so done with playing piggy back, oh

Swear to god I wished y'all all the best, oh

You're lying your way to try to gain a piece of me

When you could never come close cause I know my destiny

I worked hard for my shit

Put my love in this shit

Now you're trying to kill my name for some fame

What is this?

Tried to help you do your shit

Encouraged you to work on it

Was a good friend and you used that to your advantage



Now I'm 22 and I've had a crazy year of

Isolation from all the plastic people here

I cannot wait for the day

I can finally move away

Back to New York City where the realest people really stay, oh



Spent this whole time writing away my heart and my soul

The people I surround myself with have hearts filled with gold

Love and empathy are things that we hold so close

Trying to learn and evolve



I'm so done with playing piggy back, oh

Swear to god I wished y'all all the best, oh

You're lying your way to try to gain a piece of me

When you could never come close cause I know my destiny

I worked hard for my shit

Put my love in this shit

Now you're trying to kill my name for some fame

What is this?

Tried to help you do your shit

Encouraged you to work on it

Was a good friend and you used that to your advantage



I'm so done with playing piggy back, oh

Swear to god I wished y'all all the best, oh

You're lying your way to try to gain a piece of me

When you could never come close cause I know my destiny"
13-Feb-18,"""Mia Khalifa""",iLoveFriday,Mia Khalifa,2018,"X-X-X-Xeno Carr!
Who do you think you are?
You were sucking dick for a foreign car
Gotta take that call
They want you at work so, girl, go do your job

Mia Khalifa (Mia!)

Mia Khalifa (Mia!)

Mia Khalifa (Mia!)

Mia Khalifa (Mia!)

Mia Khalifa (Mia!)

Mia Khalifa (Mia!)

Mia Khalifa (Mia!)



We all have regrets sometimes

We wish to go back in time

(Body, body, body, body) That's a lot of lives

(Video, video) That's a lot of guys, damn

Don't you wish you changed your past?

Cause it's so bad

Don't you wish you changed your past?

Cause it's so bad

Mia Khalifa

Is that why you tried to quit three times?

Is that why you said good bye, retired

Is that why you said fuck these guys?



Who do you think you are?

You were sucking dick for a foreign car

Gotta take that call

They want you at work so, girl, go do your job

Mia Khalifa (Mia!)

Mia Khalifa (Mia!)

Mia Khalifa (Mia!)

Mia Khalifa (Mia!)

Mia Khalifa (Mia!)

Mia Khalifa (Mia!)

Mia Khalifa (Mia!)

Fight!



Hit or miss

I guess they never miss, huh?

You got a boyfriend, I bet he doesn't kiss ya

He gon' find another girl and he won't miss ya

He gon' skrrt and hit the dab like Wiz Khalifa

You play with them balls like it’s FIFA

You on every level, you’re the leader, ooh

You used to work at Whataburger

Now you pop your pussy for the Warner Brothers

(And that bangs, bro)

Shots fired, you’re fired

You’re washed up, you’re retired

Your kitty looks like a flat tire (Eww!)

I bet that your kitty real tired

Perfect!



Who do you think you are?

You were sucking dick for a foreign car

Gotta take that call

They want you at work so, girl, go do your job

(Mia!) (Mia!) (Mia!)

(Mia!) (Mia!) (Mia!)



*You win!*"
25-May-18,"""Infrared""",Pusha T,"Drake, Lil Wayne and Birdman",2018,"The game's fucked up
Niggas beats is bangin’, nigga, ya hooks did it
The lyric pennin' equal the Trumps winnin'
The bigger question is how the Russians did it
It was written like Nas but it came from Quentin
At the mercy of a game where the culture’s missing

When the CEO's blinded by the glow, it's different

Believe in myself and the Coles and Kendricks

Let the sock puppets play in their roles and gimmicks, shit

Remember Will Smith won the first Grammy?

And they ain't even recognize Hov until ""Annie""

So I don't tap dance for the crackers and sing Mammy

'Cause I'm posed to juggle these flows and nose candy (yugh) Ferrari, my 40th, blew the candles out

Tom Brady'ed you niggas, I had to scramble out

They be ridin’ these waves, I pull my sandals out

Jefe Latin my Grammy, I went the Spanish route

Oh now it’s okay to kill Baby

Niggas looked at me crazy like I really killed a baby

Salute Ross 'cause the message was pure

He see what I see when you see Wayne on tour

Flash without the fire

Another multi-platinum rapper trapped and can’t retire

Niggas get exposed, I see the cracks and I'm the liar?

Shit I've been exposed, I took the crack and built the wire

Now who do you admire? Your rap songs is all tryin' my patience

Them prices ain’t real without inflation

I done flew it, I done grew it, been a conduit

Moynat bags on my bitches, I done blew it

See through it, neck, igloo it

Habla en español, I y tu it

Let Steven talk streamin' and Shazam numbers

I'll ensure you gettin' every gram from us

Let's cram numbers, easily

The only rapper sold more dope than me was Eazy-E

How could you ever right these wrongs

When you don't even write your songs?

But let us all play along

We all know what niggas for real been waitin' on, Push"
25-May-18,"""Duppy Freestyle""",Drake,Pusha T and Kanye West,2018,
29-May-18,"""The Story of Adidon""",Pusha T,Drake,2018,"Easy money
It's about to be a surgical summer
Chop the tops off the coupes
The cuatrocientos ochenta y ocho
The Spider joint
And you know we gotta cut the heads off these snakes, right?

Watch the body drop



Drug dealin' aside, ghostwritin' aside

Let's have a heart-to-heart about your pride

Even though you're multi, I see that your soul don't look alive

The M's count different when Baby divides the pie, wait

Let's examine why

Your music for the past few years been angry and full of lies

I'll start it at the home front, ""I'm on One""

Dennis Graham stay off the gram, bitch, I'm on one

You mention wedding ring like it's a bad thing

Your father walked away at five, hell of a dad thing

Marriage is somethin' that Sandi never had, Drake

How you a winner, but she keep comin' in last place?

Monkey-suit Dennis, you parade him

A Steve Harvey-suit nigga made him

Confused, always thought you weren't Black enough

Afraid to grow it 'cause your 'fro wouldn't nap enough

Since you name-dropped my fiancée

Let 'em know who you chose as your Beyoncé

Sophie knows better, ask your baby mother

Cleaned her up for IG, but the stench is on her

A baby's involved, it's deeper than rap

We talkin' character, let me keep with the facts

You are hiding a child, let that boy come home

Deadbeat mothafucka, playin' border patrol, ooh

Adonis is your son

And he deserves more than an Adidas press run, that's real

Love that baby, respect that girl

Forget she's a pornstar, let her be your world, yuugh!

How dare you put Ye in my verses?

I'm selfish, I want all of the curses

I'm pre-bookin' the churches

Me versus three hearses

If we all go to Hell it'll be worth it

Already aligned with the greats, and on that same note

The only ones I chase are two ghosts

Still givin' you classics, that's the only thing that dates me

OVO 40, hunched over like he 80, tick, tick, tick

How much time he got? That man is sick, sick, sick

I got the devil flow, nigga, six, six, six

Surgical summer with it, snip, snip, snip

And you don't really want it with him



Surgical Summer, Volume 1

We gon' take this slow

We just gon' peel it back layer-by-layer

Yeah, DAYTONA

Album of the motherfuckin' year

And you talkin' 'bout you upset

Hahahahaha

Well I wanna see what it's like when you get angry, okay?

You show me that

Push!"
1-Jun-18,"""I Kill People""",Trippie Redd feat. Chief Keef and Tadoe,6ix9ine,2018,
31-Aug-18,"""Not Alike""","Eminem feat. Royce da 5'9""",Machine Gun Kelly,2018,
31-Aug-18,"""Bad Boy""",G-Eazy,Machine Gun Kelly,2018,
