Date Released,Song Title,Artist(s),Target(s),Year Released,lyrics
29-Jan-24,"""Big Foot""",Nicki Minaj,Megan Thee Stallion,2024,"(Been trill, been doin' it, been at it)
Your flow is such a bore
Drinkin' a bottle of Henny through a straw
Bitch, you better stop that dialogue (28 shit)
'Fore I hit Carl and buy your catalog
(Ha-ha-ha-ha-ha, ha-ha-ha-ha-ha)

Sigh

How you fuck your mother man when she die?

How you go on Gayle King and can't cry?

Chile, bye

Big Foot, but you still a small fry

Swearin' on your dead mother when you lie (Ayo)



This lil' beggin' whore talkin' 'bout Megan's Law

For a free beat, you could hit Megan raw (Ooh)

If you a ghostwriter, party in Megan jaw (Ooh)

Shots thrown, but I still ain't let Megan score (Tell 'em)

Bad bitch, she like six foot (Ooh), I call her Big Foot (Brr)

The bitch fell off, I said, ""Get up on your good foot""

Uh, still ain't topped ""Red Ruby"" (No, no, mhm)

Tryna steal the sauce, I said, ""Get up out my cookbook"" (Brr)

But really, I'm a sweetie pie

P-R-T-T-Y, but I'm P-E-T-T-Y (Brr)

Um, why did you lie about your lipo?

Fuckin' your best friend man is crazy, you the type, though

You was lyin' to the queen, then you went lyin' to the King, Gayle

The thirty-year-old tea so stale

Kylie kicked you out and made you stumble to the car

Barbz, I need a good alcohol bar

Roman, wait, that was the bar

Like a body builder, I keep raisin' the bar

Fuck you get shot with no scar? (Brr)

This little piggy toxic, somebody adopt it

Mm, mm-mm, mm-mm

Shit'll get dark like chocolate

I'm 'bout to get up in your ass, bitch, clench (Woo)

Mm, yeah, sorta like French

They got you all them Grammys, but your flow's still a no

What a fiasco, Lupe

Future made you pay (Haha)

She wanna party with DaBaby while rubbin' on Tory toupée

I guess she needed money bags for them Trey Songz

She G-Eazy, Carl made her crawl for it

Yo, why the fuck they poke the monster?

Fuckin' with Nicki this year, ho, I'm comin' like a pornstar

She just mad that no nigga ever loved her

No nigga gon' stand ten toes behind her

Is it my fault I got good vagin-er?

Why the fuck is you humpin' on a minor?

'Cause she was lyin' on your dead mama (Ooh), on-on your dead mama (Ah-ah-ah-ah)

Lyin' on your dead mama, on-on your dead mama

Lyin' on your dead mama, lyin' on your dead mama

Lyin' on your, lyin', lyin', lyin' on your dead mama (Brr, ooh)



Now listen up, Big Foot

You know I got a lotta tea

I went easy on you

Umm (Glass-fragment-foot-ass bitch)

You know, whenever I meet a woman that would fuck her friend's man

(And let your friend talk about your ex-friend baby on the internet)

I know that (No, no), they have a very evil spirit

Um (Where my prayer warriors at?)

I don't think you want the next installment of this song

I know it's the most attention you've ever gotten

One-flow ho, but, uh, trust

If you don't apologize to your mama in twenty-four hours

Shit gon' get uglier than KenBarbie, okay? Don't play

Um, and also, I'd like to say

To my supporters, I love you, may God bless you, you're amazing

Um, all the good-pussy gyal dem too, yes

But

I'm very serious

Ho, the things that you've lied about

Even pertaining to your mom

You don't want them out, okay?

Now

Since you think it's funny to speak about people's families

We'll all join in

We'll all play the reindeer games

Soon as your new nose heals

And soon as your—

Well, let's leave that for the second installment, rrr"
31-Jan-24,"""Rap Elvis""",Benzino,Eminem,2024,
3-Feb-24,"""Femzino""",Cashis,Benzino,2024,
9-Feb-24,Sunday Service,Latto,Ice Spice and Nicki Minaj,2024,"Go Grizz
Pooh, you a fool for this one
B-B-Bankroll Got It
I don't sing R&B but, bitch, I'm really her, fuck wrong with niggas?
How you let him cheat and take him back? Must be your only nigga (The fuck?)

I get loud just like my weed, I don't watch my tone with niggas

I hang up the phone on niggas (Click)

You ain't my daddy, bitch, I'm big mama (Bitch)

Every time y'all book me with them hoes, it's gon' be big drama (Grrah)

Twenty black Suburbans, we pull up like Sunday Service (Skrrt)

I just want a one on one, don't know why she so nervous (Boop)

Fuck what these hoes sayin' 'cause my nigga say I'm perfect (Tuh)



Anyway, body count so low, I might say I'm a virgin (Ooh)

Any day, I could switch my car just like I switch my purses (Skrrt)

Andale, quick to cut him off if he don't serve no purpose

You a clown and I'm allergic, niggas straight up out the circus (Haha)

It's the nerve for me, these niggas burnt, they third degree

He callin' tryin' to work it out, I'd rather make him work for me (The fuck?)

He can't tell if it's authentic or it's surgery, please, Lil Nas X the only nigga curvin' me



I don't sing R&B but, bitch, I'm really her, fuck wrong with niggas?

How you let him cheat and take him back? Must be your only nigga (The fuck?)

I get loud just like my weed, I don't watch my tone with niggas

I hang up the phone on niggas (Click)

You ain't my daddy, bitch, I'm big mama (Bitch)

Every time y'all book me with them hoes, it's gon' be big drama (Grrah)

Twenty black Suburbans, we pull up like Sunday Service (Skrrt)

I just want a one on one, don't know why she so nervous (Boop, ha)

Fuck what these hoes sayin' 'cause my nigga say I'm perfect (Tuh)



Tell the truth, oh, I'm not that cute? Bet you won't ask your boo

He get money, I get money too, like, who gon' trick on who? (Who?)

These bitches corny, soon as monkey see, then you know monkey do

Do you rap or do you tweet? 'Cause I can't tell, get in the booth, bitch (Bitch)

Stop all that motherfuckin' yellin', ho (Yellin', ho, why?)

'Cause I ain't buyin' what you're sellin', ho (Sellin', ho)

Think I'm the shit? Bitch, I know it, ho

Jesus walked on water, I got ice boilin' though (Aha)

Miss me with that sucker shit, I'm not your baby mama

Blocked his ass on everything, he in my DM's writin' albums (Brr)

Better hold your nigga tight, 'fore I make you come up off him

Say two wrongs don't make a right, but I'm the type get one up on 'em



I don't sing R&B but, bitch, I'm really her, fuck wrong with niggas?

How you let him cheat and take him back? Must be your only nigga (The fuck?)

I get loud just like my weed, I don't watch my tone with niggas

I hang up the phone on niggas (Click)

You ain't my daddy, bitch, I'm big mama (Bitch)

Every time y'all book me with them hoes, it's gon' be big drama (Grrah)

Twenty black Suburbans, we pull up like Sunday Service (Skrrt)

I just want a one on one, don't know why she so nervous (Boop)

Fuck what these hoes sayin' 'cause my nigga say I'm perfect (Tuh)



Tuh

Twenty black Suburbans, we pull up like Sunday Service

Anyway (Anyway)

Come on

Fuck what these hoes sayin' 'cause my nigga say I'm perfect

Tuh"
22-Mar-24,"""Like That""","Metro Boomin, Future, Kendrick Lamar","Drake, J. Cole",2024,
5-Apr-24,"""7 Minute Drill""",J. Cole,Kendrick Lamar,2024,"Yeah
Turn it up
Yeah, turn the vocal up
Uh
Light work like it's PWC

It's a cold world, keep the heat under your seat

I got a phone call, they say that somebody dissin'

You want some attention, it come with extensions

My dog like, ""Say the word,"" he on bullshit, he itchin'

Done put in so much work in these streets, he got pension

I told him chill out, how I look havin' henchman?

If shots get to poppin', I'm the one doin' the clenchin'



I came up in the 'Ville, so I'm good when it's tension

He still doin' shows, but fell off like the Simpsons

Your first shit was classic, your last shit was tragic

Your second shit put niggas to sleep, but they gassed it

Your third shit was massive and that was your prime

I was trailin' right behind and I just now hit mine

Now I'm front of the line with a comfortable lead

How ironic, soon as I got it, now he want somethin' with me

Well, he caught me at the perfect time, jump up and see

Boy, I got here off of bars, not no controversy

Funny thing about it, bitch, I don't even want the prestige

Fuck the Grammys 'cause them crackers ain't never done nothin' for me, ho

Slugs took my nigga's soul, drugs took another one

The rap beef ain't realer than the shit I seen in Cumberland

He averagin' one hard verse like every thirty months or somethin'

If he wasn't dissin', then we wouldn't be discussin' him

Lord, don't make me have to smoke this nigga 'cause I fuck with him

But push come to shove, on this mic, I will humble him

I'm Nino with this thing, this that New Jack City meme

Yeah, I'm aimin' at G-Money, cryin' tears before I bust at him



Light work like it's PWC

It's a cold world, keep the heat under your seat

I got a phone call, they say that somebody dissin'

You want some attention, it come with extensions

My dog like, ""Say the word,"" he on bullshit, he itchin'

Done put in so much work in these streets, he got pension

I told him chill out, how I look havin' henchman?

If shots get to poppin', I'm the one doin' the— (Conductor, conductor, conductor)



I got mixed feelings 'bout these fuckin' rap niggas

It's over for that cap, we official cap peelers

Two-six, we don't at niggas, we get at niggas

Shoot a nigga lights out, yeah, my dogs stat fillers

Stat stuffers, triple-double, get your ass black duffled

Body bag, body bag, body bag

Cole World your instructor for pilates class

Get a nigga stretched if I feel the disrespect, uh

Your arms might be too short to box with the god

Who live his life without the pressures of a constant facade

I pray for peace, but if a nigga cease these positive vibes

A Falcon 9 inside my pocket, bitch, this rocket gon' fly

Now it's poppin' outside like the top of July

My text flooded with the hunger for a toxic reply

I'm hesitant, I love my brother, but I'm not gonna lie

I'm powered up for real, that shit would feel like swattin' a fly

Four albums in twelve years, nigga, I can divide

Shit, if this is what you want, I'm indulgin' in violence

Put pictures in my home, aim the chrome at your eyelids

Fly pebbles at your dome, we the Stone Temple Pilots

This is merely a warning shot to back niggas down

Back in the town where they whippin' work and traffickin' pounds

My jack jumpin' 'bout a rapper makin' blasphemous sounds

Switchin' sides like the tassel on the cap and the gown

I'm fully loaded, nigga, I can drop two classics right now



Hah, let me chill out, man (Conductor)

The Fall Off on the way, nigga"
12-Apr-24,"""Tender""",Quavo,Chris Brown,2024,
"Apr 13, 2024 (leaked) Apr 19, 2024 (Official)","""Push Ups""",Drake,"Kendrick Lamar, Metro Boomin, Future, Rick Ross, The Weeknd",ial),"(Whoo Kid)
Ayy
I could never be nobody number-one fan
Your first number one, I had to put it in your hand
You pussies can't get booked outside America for nan'

I'm out in Tokyo because I'm big in Japan

I'm the hitmaker y'all depend on

Backstage in my city, it was friendzone

You won't ever take no chain off of us

How the fuck you big steppin' with a size-seven men's on?

This the bark with the bite, nigga, what's up?

I know my picture on the wall when y'all cook up

Extortion baby, whole career, you been shook up

'Cause Top told you, ""Drop and give me fifty,"" like some push-ups, huh

Your last one bricked, you really not on shit

They make excuses for you 'cause they hate to see me lit

Pull your contract 'cause we gotta see the split

The way you doin' splits, bitch, your pants might rip

You better do that motherfuckin' show inside the bity

Maroon 5 need a verse, you better make it witty

Then we need a verse for the Swifties

Top say drop, you better drop and give 'em fifty

Pipsqueak, pipe down

You ain't in no big three, SZA got you wiped down

Travis got you wiped down, Savage got you wiped down

Like your label, boy, you in a scope right now

And you gon' feel the aftermath of what I write down

I'm at the top of the mountain, so you tight now

Just to have this talk with your ass, I had to hike down

Big difference 'tween Mike then and Mike now

What the fuck is this, a twenty-v-one, nigga?

What's a prince to a king? He a son, nigga

Get more love in the city that you from, nigga

Metro, shut your ho ass up and make some drums, nigga

Yeah, I'm the 6ix God, I'm the frontrunner

Y'all nigga manager was Chubbs lil' blunt runner

Claim the 6ix and you boys ain't even come from it

And when you boys got rich, you had to run from it

Cash blowin' Abel bread, out here trickin' (Out here trickin')

Shit we do for bitches, he doin' for niggas (What the fuck?)

Jets, whips, chains, wicked, wicked, wicked (Wicked, wicked)

Spend it like you tryna fuck, boy, you trippin', boy, you trippin'

Drizzy Chip 'n Dale, probably got your bitch Chanel

I just got 'em done, boy, don't make me have to chip a nail

Rolling Loud stage, y'all were turnt, that was slick as hell

Shit'll probably change if your BM start to kiss and tell

Hugs and kisses, man, don't tell me 'bout no switches

I'll be rockin' every fuckin' chain I own next visit, ayy

I be with some bodyguards like Whitney

Top say drop, your little midget ass better fuckin'



Ayy, better drop and give me fifty, ayy

Drop and give me fifty, drop and give me fifty, ayy

Niggas really got me out here talkin' like I'm 50, ayy

Niggas really got me out here rappin' what I'm livin'



I might take your latest girl and cuff her like I'm Ricky

Can't believe he jumpin' in, this nigga turnin' fifty

Every song that made it on the chart, he got from Drizzy

Spend that lil' check you got and stay up out my business

Nigga, shout out to the hooper that be bustin' out the griddy

We know why you mad, nigga, I ain't even trippin'

All that lil' heartbroken Twitter shit for bitches

This for all the top dogs, drop and give me fifty, drop, drop

And that fuckin' song y'all got did not start the beef with us

This shit been brewin' in a pot, now I'm heatin' up

I don't care what Cole think, that Dot shit was weak as fuck

Champagne trippin', he is not fuckin' easin' up

Nigga callin' Top to see if Top wanna peace it up

""Top, wanna peace it up? Top, wanna peace it up?""

Nah, pussy, now you on your own when you speakin' up

You done rolled deep to this, it's not fuckin' deep enough

Beggin' Kai Cenat, boy, you not fuckin' beatin' us

Numbers-wise, I'm out of here, you not fuckin' creepin' up

Money-wise, I'm out of here, you not fuckin' sneakin' up

Cornball, your show money merch money fee to us

I'ma let you niggas work it out because I seen enough

This ain't even everything I know, don't wake the demon up

This ain't even everything I know, don't wake the demon up

Drop and give me fifty, all you fuck niggas teamin' up



What top five you smokin' on, Kendrick?



Mmm, mmm, yeah

Drop, drop, drop, drop

Drop a fifty bag for the mob in the spot

Drop a fifty bag, twenty-nine for the thot

Uh, I was really, really tryna keep it PG"
13-Apr-24,"""Champagne Moments""",Rick Ross,Drake,2024,"Maybach Music
Fish tanks and marble floors, livin' big and bad
Niggas laugh until they hit with my official jab
Crack smoke is the exhaust from my pen and pad
Ghostwriters, they get to floss what you could’ve had

Record label takin' a loss, are you in your bag?

You a worker wantin' to chart, don’t make me laugh

Get to mine, tell by my watch, this a different time

Livin' fine, I'm gettin' high as your shit decline

Who believes he movin' keys in his Louis V's?

Run up on you and snatch your chain, watch you bitches bleed

Feel the pain or just describe where you really ride

Either you niggas gettin' money or ready to die

B-I-G or give a fuck if you Chi-Ali

You got it and you keep it tucked if you be by me

Do the job, better known as the Charles Schwab

Double R's spread through the yard, and I swear to God



Pop a Perc’ for the feel, go and count me a mil’

Kill you niggas for free, do it all for the thrill

Niggas leakin' they records when we speakin’ directly

If we keepin' it gangster, when you see me, you check me



White boy, I see you, I see you

Yeah, check



Gettin' bullied, don't walk up on me ’cause the clip is fully

Niggas pussy, don't want to push me, I'm like, ""Really, would he?""

Like his moves, but he never had to fight in school

Always ran, another nigga had to write your grooves

Flow is copy-and-paste, Weezy gave you the juice

Another white boy at the park wanna hang with the crew

Pulitzer Prize winner switchin' up like dyed denim

Get incentives for all the killings while we ride rentals

Look me right in my face, he beginnin' to shake

Told you niggas ""Stay schemin',"" I predicted my fate

""Got more money than you,"" fuck you want me to say?

Fifty mil' for the crib, where you want me to stay?

I could shoot up the block, I got pictures to paint

Let you DM my ho, but got bitches you can't

Let you get on my songs, it was good for your face

Now, bitch nigga, it's on, ain't no room for debate



Pop a Perc' for the feel, go and count me a mil'

Kill you niggas for free, do it all for the thrill

Niggas leakin' they records when we speakin' directly

If we keepin' it gangster, when you see me, you check me



By the way, I got a lot of respect for a lot of rappers, but I got one guy

He's my favorite person to rap with on any song, his name is Rick Ross

(Maybach Music)

You ain't never want to be a nigga anyway, nigga

That's why you had an operation to make your nose smaller than your father nose, nigga

I unfollowed you, nigga, 'cause you sent the motherfuckin' cease-and-desist to French Montana, nigga

You sent the police, nigga, hated on my dog project

That wasn't the same white boy that I seen, nigga, when we were makin' them early records, nigga

When you were happy to be 'round niggas, seein' niggas holdin' them sticks, yeah

You owe motherfuckin' Stunna your life, nigga

Give Weezy some more money, nigga

Give Rap-A-Lot some more money, nigga

White boy

Yeah, biggest

It's Rozay, nigga

We can do it how you wanna do it, where you wanna do it, any time you wanna do it, I'm ready

I'm ready, white boy, huh?

I know you got your Dockers on with no underwear, white boy

Yeah, you had that surgery, that six-pack gone

That's why you wearin' that funny shit at your show, you can't hide it, nigga

White boy"
19-Apr-24,"""Weakest Link""",Chris Brown,Quavo,2024,
19-Apr-24,"""Taylor Made Freestyle""",Drake,Kendrick Lamar,2024,
21-Apr-24,"""Like That (Remix)""","Kanye West, Ty Dolla Sign, Metro Boomin, Future","Drake, J. Cole",2024,
22-Apr-24,"""Over Hoes & Bitches (feat. Takeoff)""",Quavo,Chris Brown,2024,
