Date Released,Song Title,Artist(s),Target(s),Year Released,lyrics
4-Dec-01,"""Ether""",Nas,Jay-Z and Roc-A-Fella Records,2001,"[gunshots]
[Nas talking]
(""Fuck Jay-Z"")
What's up niggas, ay yo, I know you ain't talkin 'bout me dog
You, what?

(""Fuck Jay-Z"")

You been on my dick nigga, you love my style, nigga

(""Fuck Jay-Z"")



[Chorus]

(I) Fuck with your soul like ether

(Will) Teach you the king you know you

(Not) ""God's son"" across the belly

(Lose) I prove you lost already



Brace yourself for the main event

Y'all impatiently waitin

It's like an AIDS test, what's the results?

Not positive, who's the best? Pac, Nas and Big

Ain't no best, East, West, North, South, flossed out, greedy

I embrace y'all with napalm

Blows up, no guts, left chest, face gone

How could Nas be garbage?

Semi-autos at your cartilege

Burner at the side of your dome, come outta my throne

I got this, locked since '9-1

I am the truest, name a rapper that I ain't influenced

Gave y'all chapters but now I keep my eyes on the Judas

With Hawaiin Sophie fame, kept my name in his music

Check it



[Chorus]



[talking]

Ay yo, pass me the weed, pour my ashes out on these niggas man (no doubt)

Ay, y'all faggots, y'all kneel and kiss the fuckin ring



[Chorus]



I've been fucked over, left for dead, dissed and fogotten

Luck ran out, they hoped that I'd be gone, stiff and rotten

Y'all just piss on me, shit on me, spit on my grave (uh)

Talk about me, laugh behind my back but in my face

Y'all some well wishin (bitches), friendly actin envy hidin snakes

With your hands out for my money, man, how much can I take?

When these streets keep callin, heard it when I was sleep

That this Gay-Z and Cockafella Records wanted beef

Started cockin up my weapon, slowly loadin up this ammo

To explode it on a camel, and his soldiers, I can handle

This for dolo and his manuscript just sound stupid

When KRS already made an album called ""Blueprint""

First, Biggie's ya man, then you got the nerve to say that you better than Big

Dick suckin lips, whyn't you let the late, great veteran live



[talking]

(I...will...not...lose)

""God's son"" across the belly, I prove you lost already

The king is back, where my crown at?

(Ill...will) Ill Will rest in peace, let's do it niggas



[Chorus]



Y'all niggas deal with emotions like bitches

What's sad is I love you 'cause you're my brother

You traded your soul for riches

My child, I've watched you grow up to be famous

And now I smile like a proud dad, watchin his only son that made it

You seem to be only concerned with dissin women

Were you abused as a child, scared to smile, they called you ugly?

Well life is harsh, hug me, don't reject me

or make records to disrespect me, blatant or indirectly

In '88 you was gettin chased through your buildin

Callin my crib and I ain't even give you my numbers

All I did was gave you a style for you to run with

Smilin in my face, glad to break bread with the god

Wearin Jaz chains, no tecs, no cash, no cars

No jail bars Jigga, no pies, no case

Just Hawaiian shirts, hangin with little Chase

You a fan, a phony, a fake, a pussy, a Stan

I still whip your ass, you thirty-six in a karate class

You Tae-bo hoe, tryna' work it out, you tryna' get brolic?

Ask me if I'm tryna' kick knowledge

Nah, I'm tryna' kick the shit you need to learn though

That ether, that shit that make your soul burn slow

Is he Dame Diddy, Dame Daddy or Dame Dummy?

Oh, I get it, you Biggie and he's Puffy

Rockefeller died of AIDS, that was the end of his chapter

And that's the guy y'all chose to name your company after?

Put it together, I rock hoes, y'all rock fellas

And now y'all try to take my spot, fellas?

Philly's hot rock fellas, put you in a dry spot, fellas

In a pine box with nine shots from my glock, fellas

Foxy got you hot 'cause you kept your face in her puss

What you think, you gettin girls now 'cause of your looks?

Ne-gro please

You no mustache havin, with whiskers like a rat

Compared to Beans you wack

And your man stabbed Un and made you take the blame

You ass, went from Jaz to hangin with Kane, to Irv, to Big

And, Eminem murdered you on your own shit

You a dick-ridin faggot, you love the attention

Queens niggas run you niggas, ask Russell Simmons

Ha, R-O-C get gunned up and clapped quick

J.J. Evans get gunned up and clapped quick

Your whole damn record label gunned up and clapped quick

Shaun Carter to Jay-Z, damn you on Jaz dick

So little shorty's gettin gunned up and clapped quick

How much of Biggie's rhymes is gon' come out your fat lips?

Wanted to be on every last one of my classics

You pop shit, apologize, nigga, just ask Kiss"
11-Dec-01,"""Supa Ugly""",Jay-Z,Nas,2001,
13-May-02,"""Without Me""",Eminem,"Dick Cheney, Lynne Cheney, Limp Bizkit, Moby, Chris Kirkpatrick, and the FCC",2002,"Obie Trice! Real name, no gimmicks – (*record scratch*)
Two trailer park girls go 'round the outside
'Round the outside, 'round the outside
Two trailer park girls go 'round the outside
'Round the outside, 'round the outside



Guess who's back, back again

Shady's back, tell a friend

Guess who's back, guess who's back

Guess who's back, guess who's back



I've created a monster, ‘cause nobody wants to

See Marshall no more, they want Shady, I'm chopped liver

Well, if you want Shady, this is what I'll give ya

A little bit of weed mixed with some hard liquor

Some vodka that'll jump start my heart quicker

Than a shock when I get shocked at the hospital

By the doctor when I'm not co-operating

When I'm rocking the table while he's operating (heyyy!)

You waited this long, now stop debating

‘Cause I'm back, I'm on the rag and ovulating

I know that you got a job, Ms. Cheney

But your husband's heart problem's complicating

So the FCC won't let me be

Or let me be me, so let me see

They try to shut me down on MTV

But it feels so empty without me

So, come on and dip, bum on your lips

Fuck that! Cum on your lips and some on your tits

And get ready, ‘cause this shit's about to get heavy

I just settled all my lawsuits—fuck you, Debbie!



Now this looks like a job for me

So everybody, just follow me!

‘Cause we need a little controversy

‘Cause it feels so empty without me

I said this looks like a job for me

So everybody, just follow me!

‘Cause we need a little controversy

‘Cause it feels so empty without me



Little hellions, kids feeling rebellious

Embarrassed their parents still listen to Elvis

They start feeling like prisoners helpless

'Til someone comes along on a mission and yells, ""Bitch!!!""

A visionary, vision is scary

Could start a revolution, polluting the airwaves

A rebel, so just let me revel and bask

In the fact that I got everyone kissing my ass {​​smack}​​

And it's a disaster, such a catastrophe

For you to see so damn much of my ass—you asked for me?

Well, I'm back, na-na-na-na-na-na-na-na-na-na

Fix your bent antenna, tune it in, and then I'm gonna

Enter in, and up under your skin like a splinter

The center of attention, back for the winter

I'm interesting, the best thing since wrestling

Infesting in your kid's ears and nesting

Testing, attention please

Feel the tension soon as someone mentions me

Here's my ten cents, my two cents is free

A nuisance, who sent? You sent for me?



Now this looks like a job for me

So everybody, just follow me!

‘Cause we need a little controversy

‘Cause it feels so empty without me

I said this looks like a job for me

So everybody, just follow me!

‘Cause we need a little controversy

‘Cause it feels so empty without me



A tisk-it a task-it, I'll go tit for tat with

Anybody who's talking ""this shit, that shit""

Chris Kirkpatrick, you can get your ass kicked

Worse than them little Limp Bizkit bastards

And Moby? You can get stomped by Obie

You 36-year-old baldheaded fag, blow me!

You don't know me, you're too old, let go

It's over, nobody listens to techno

Now let's go, just give me the signal

I'll be there with a whole list full of new insults

I been dope, suspenseful with a pencil

Ever since Prince turned himself into a symbol

But sometimes the shit just seems

Everybody only wants to discuss me

So this must mean I'm disgusting

But it's just me, I'm just obscene

No, I'm not the first king of controversy

I am the worst thing since Elvis Presley

To do black music so selfishly

And use it to get myself wealthy

(Heyyy!) There's a concept that works

Twenty million other white rappers emerge

But no matter how many fish in the sea

It'll be so empty without me



Now this looks like a job for me

So everybody, just follow me!

‘Cause we need a little controversy

‘Cause it feels so empty without me

I said this looks like a job for me

So everybody, just follow me!

‘Cause we need a little controversy

‘Cause it feels so empty without me



Hum dei dei la la Hum dei dei la la la la la

Hum dei dei la la Hum dei dei la la la la la

Kids!"
26-May-02,"""Bump Heads""","Eminem feat. Tony Yayo, Lloyd Banks and 50 Cent",Ja Rule,2002,
21-Nov-02,"""Nail In The Coffin""",Eminem,Benzino,2002,"[Eminem]
This motherfucker man, just won't shut up will you? 
Talk about I owe you, bitch you owe me 
I'm promoting you right now
Man lets put the nail in his coffin 


[Chorus]

I dont want to be like this 

I dont really want to hurt no feelins 

But Im only bein real when I say nobody wants to hear their grandfather rap 

Old men have heart attacks 

and I dont want to be responsible for that so 

Put the mic down and walk away 

You can still have a little bit of dignity 



[verse 1]

I would never claim to be no Ray Benzino 

an 83 year old fake Pachino 

So how can he hold me over some balcony 

without throwin his lower back out as soon as he goes to lift me 

Please dont, youl probably fall with me 

and our asses will both be history 

But then again youl finnally get your wish 

cuz youl be all over the street like 50 Cent 

Fuckin punk pussy fuck you chump 

gimme a one-on-one see if I dont fuck you up 

Tryin to jump the Ruff Ryders and they cut you up 

And you put Jada on a track thats how much you suck 

dick in the industry, swear that you in the streets hustlin 

You sit behind a fuckin desk at The Source butt-kissin 

and beggin motherfuckers for guest appearences 

and you can even get the clearances cuz real lyricists 

dont even respect you or take you serious 

Its not that we dont like you, we hate you - period 

Talk about a mid-life crisis damn 

last week you was shakin Obie Trice's hand 

Now hes a busta? What the fucks with that? 

Get on a track dissin us kissin 50's ass 

and askin me what I know about inditements-bite me 

bitch I got two cases, and probation - fight me! 

What do I know about standin in front of a judge like a man 

ready to take whatever sentence he hands 

What you know about your wife slicin her wrists 

right in front of the only thing you have in this world - a little girl? 

And I put that on her, when this is all over 

I would never try to make her a star and eat off her 

I dont know shit about no shoppin rocks 

But what you know about hip-hop shops rockin spots? 

When your the only white boy in that bitch just rippin 

pressin up your own flyers and your stickers stickin 

them bitches up after spendin six hours at Kinkos 

Just makin copys of your covers of casette singles 

and sell them out the trunk of your Tracer 

Spendin your whole paycheck at Disc Makers 

What you know about bein bullied over half your life? 

Oh thats right, you know what thats like, your half white 

Vanilla Ice,spill the beans and rice, Im eaten you alive inside 

Jesus Christ, if your that much of a gangster, put the mic down 

You should be out killin motherfuckers right now 

Kill a motherfucker dead, kill'em dead bitch 

Shoot'em in the fuckin head, go ahead bitch 

Slap my mom, slap the f*ck outa her! 

She cant sue you, she wouldnt get a buck out of you 

Cuz your broke as fuck you suck your a fuckin joke 

If you was really sellin coke, well then what the fuck 

you stop for dummy? If you slew some crack 

you'd make alot more money than you do from rap 

You never had no security, you'll never be famous 

You'l never now what its like to be rich, lifes a bitch aint it? 

Raymond, here, let me break this shit down in lamens 

terms for you just to make sure that you can understand this 

and Canibus they usin too many complicated fuckin words for you 

Here then let me slow it down for you 

so you can understand if I say it slower: 

Let it go dawg it's over 



[Chorus]



[Eminem talkin]

Haha 

Talkin bout I have motherfuckers callin your crib 

bitch you aint even got a fuckin crib 

You aint even got a fuckin phone, fuckin Bum

Threatened to shut me down at your little fuckin Source magazine 

if I come back then you would attack me, bitch you attacked me first 

take it like a man and shut the fuck up 

and fuck your little magazine too 

I dont need your fuckin magazine, I got XXL number anywayz 

And yall cant stand it cuz there gettin bigger than yall 

oh, and by the way, howed I look on the VMAs? 

When you was watchin me from whatever fuckin TV you was watchin me from in Boston 

The mean streets of Boston, fuckin sissy 

Like you got us scared in the motherfucker, suck our motherfuckin dicks 

Oh, and for those thats dont know, dont get it twisted yo, the Source has a white owner"
21-Nov-02,"""The Sauce""",Eminem,Benzino,2002,"[Eminem talkin']
Its all bad now man, its all bad 
But yal done fucked up now 
Yeah ha ha, new shit, hey yo 
I just want the whole world to know: 
That I did not start this, but I will finish it 



[Verse]

Comin up it never mattered was color you was 

If you could spit then you could spit, thats it, thats what it was 

Back when, motherf*ckers was straight back packin 

Cypherin, fightin for life in this rap 

for the mic to get past and you psyched and you gasped 

and you hyped cuz you last and you might whoop some ass 

If you lost then you lost shake hands like a man 

and you swallowed it, when the unsigned hype column 

at The Source was like, the only source of light 

When the mics used to mean somethin, a four was like 

you were the ****, now its like the least you get 

three and a half now just means you a peice of **** 

four and a half or five, means you Biggie, Jigga, Nas, 

or Benzino I dont think you even realize 

you playin with motherf*ckers lives, I dont watched Dre 

get ****ed on The Chronic, probably cuz I was on it 

Now you f*cked me outa my mics twice I let it slide 

I said I wouldnt hold my f*cken breathto get a five 

Sh*t I was right, Ida f*ckin died already tryin 

I swear to God I never lie I bet thats why 

you let that b*tch give me that bullsh*t review 

I sat and took it, I aint look at the sh*t we knew 

You'd probly try to f*ck us with Obie and 50 too 

F*ck a relationship we through 

No more Source with street cred, them days is dead 

Dre's got A-Ks to dave mase's head 

Every issue there's an eight page Made-Mens spread 

Will somebody please tell whoever braids his head 

That I am not afraid, hes just a f*ckin waste of lead 

on my pencil, for me to write some sh*t this simple 

So listen closely, as I break it down and proceed 

This old Gs bout to get smoked like raw weed 

You dont know me or my motherf*ckin mother you motherf*ckin punk 

Put me on your motherf*ckin cover to sell your little sell out mag 

I aint mad I feel bad, heres an ad, heres a poster of Ray-Ray and his dad 

You wanna talk about some sh*t that you dont know about? ya 

Lets talk about how your puttin you own son out there 

To try to eat off him, cuz you missed your boat 

Your never gonna float b*tch your just too old 

No wonder your sore now ?? your bored now 

Im pushin thirty your kickin fourty's door down 

B*tch this is war now, and youl never beat me 

all you do is cheat me out of quatables but you know 

that youl always see me on your TV 

Cuz you gotta stay up till three in the mornin 

To see your video played once on BET 

So he-he-he who gets the last laugh? 

Aftermath ya so on behalf on our whole staff 

kiss our ass-hole cracks we'll never fold or hold back 

Just know that Benzinos wack 

no matter how many times I say his name, hell never blow jack 

Your better off tryin to bring R-S-O back 

Look at your track record thats how far it goes back 

Its extortion ?? proportion 

so half of the staff up there is fresh outa jail from boston 

Bullyin and bossin, caged like a slave they've completely brainwashed him 

And forced him to stay locked in his own office afraid of the softest 

fakest, wannabe gangster in New York 

And its pitiful, cuz I never woulda said sh*t to you if you'd kept your mouth shut 

B*tch now what? get a clue, spit it slay 

New sh*t, exclusive ?? whoo kid

You know what to do with this: use it 

Im through, this is stupid, I cant believe I stooped to this 

bullsh*t to do this... 



And who you callin a b*tch? B*tch. You owe me"
25-Nov-02,"""Cry Me a River""",Justin Timberlake,Britney Spears,2002,"You were my sun
You were my earth
But you didn't know all the ways I loved you, no
So you took a chance
Made other plans
But I bet you didn't think your thing would come crashing down, no



You don't have to say, what you did

I already know, I found out from him

There is just no chance, of you and me, there'll never be

And don't it make you sad about it



You told me you loved me

Why did you leave me, all alone?

Now you tell me you need me

When you call me, on the phone

Girl I refuse, you must have me confused

With some other guy

Your bridges were burned, and now it's your turn

To cry, cry me a river

Cry me a river

Cry me a river

Cry me a river, yeah, yeah



I know that they say

That some things are better left unsaid

It wasn't like you only talked to him

And you know it (don't act like you don't know it)

All of the these things people told me

Keep messing with my head (messing with my head)

You should have picked honesty

Then you may not have lost the game



You don't have to say, what you did

I already know, I found out from him

There is just no chance, of you and me, there'll never be

And don't it make you sad about it



You told me you loved me

Why did you leave me, all alone?

Now you tell me you need me

When you call me, on the phone

Girl I refuse, you must have me confused

With some other guy

Your bridges were burned, and now it's your turn

To cry, cry me a river

Cry me a river

Cry me a river

Cry me a river, yeah, yeah

Oh the damage is done

So I guess I'll be leaving

Oh the damage is done

So I guess I'll be leaving

Oh the damage is done

So I guess I'll be leaving





Cry me a river

Cry me a river

You can go on and just

Cry me a river

Cry me a river

You can go on and just

Cry me a river

Cry me a river"
21-Jan-03,"""Superman""",Eminem,Mariah Carey,2003,"(Mhmmm) *inhales*
You high, baby? (Yeah)
Yeah? (Talk to me!)
You want me to tell you something? (Uh huh)
I know what you wanna hear

I know you want me, baby, I think I want you too

(I think I love you, baby) I think I love you too

I'm here to save you, girl, come be in Shady's world

I wanna grow together, let's let our love unfurl

You know you want me, baby, you know I want you too

They call me Superman, I'm here to rescue you

I wanna save you, girl, come be in Shady's world

(Ooh boy, you drive me crazy) Bitch, you make me hurl



They call me Superman

Leap tall hoes in a single bound

I'm single now: got no ring on this finger now

I'd never let another chick bring me down

In a relationship; save it, bitch!

Babysit? You make me sick

Superman ain't savin' shit

Girl, you can jump on Shady's dick

Straight from the hip, cut to the chase

I tell a motherfuckin' slut to her face

Play no games, say no names

Ever since I broke up with what's-her-face

I'm a different man, kiss my ass

Kiss my lips? Bitch, why ask?

Kiss my dick, get my cash?

I'd rather have you whip my ass

Don't put out, I'll put you out

Won't get out, I'll push you out

Puss blew out, poppin' shit

Wouldn't piss on fire to put you out

Am I too nice? Buy you ice?

Bitch, if you died, wouldn't buy you life

What, you tryin' to be my new wife?

What, you Mariah? Fly through twice



But I do know one thing though

Bitches, they come, they go

Saturday through Sunday, Monday

Monday through Sunday, yo

Maybe I'll love you one day

Maybe we'll someday grow

'Til then just sit your drunk ass on that fuckin' runway, ho



Cause I can't be your Superman

Can't be your Superman

Can't be your Superman

Can't be your Superman

I can't be your Superman

Can't be your Superman

Can't be your Superman

Your Superman, your Superman



Don't get me wrong, I love these hoes

It's no secret, everybody knows

Yeah, we fucked: bitch, so what?

That's about as far as your buddy goes

We'll be friends, I'll call you again

I'll chase you around every bar you attend

Never know what kinda car I be in

We'll see how much you be partyin' then

You don't want that, neither do I

I don't wanna flip when I see you with guys

Too much pride, between you and I

Not a jealous man, but females lie

But I guess that's just what sluts do

How could it ever be just us two?

I'd never love you enough to trust you

We just met and I just fucked you



But I do know one thing though

Bitches, they come, they go

Saturday through Sunday, Monday

Monday through Sunday, yo

Maybe I'll love you one day

Maybe we'll someday grow

'Til then just sit your drunk ass on that fuckin' runway, ho



Cause I can't be your Superman

Can't be your Superman

Can't be your Superman

Can't be your Superman

I can't be your Superman

Can't be your Superman

Can't be your Superman

Your Superman, your Superman

I can't be your Superman

Can't be your Superman

Can't be your Superman

Can't be your Superman

I can't be your Superman

Can't be your Superman

Can't be your Superman

Your Superman, your Superman



I know you want me, baby, I think I want you too

(I think I love you, baby) I think I love you too

I'm here to save you, girl, come be in Shady's world

I wanna grow together, let's let our love unfurl

You know you want me, baby, you know I want you too

They call me Superman, I'm here to rescue you

I wanna save you, girl, come be in Shady's world

(Ooh boy, you drive me crazy) Bitch, you make me hurl



First thing you say: (I'm not fazed

I hang around big stars all day

I don't see what the big deal is anyway

You're just plain old Marshall to me)

Ooh yeah, girl, run that game

(Hailie Jade, I love that name

Love that tattoo, what's that say?

""Rot In Pieces,"" uh, that's great)

First off, you don't know Marshall

At all, so don't grow partial

That's ammo for my arsenal

I'll slap you off that bar stool

There goes another lawsuit

Leave handprints all across you

Good Lordy, whoadie

You must be gone off that water bottle

You want what you can't have

Ooh girl, that's too damn bad

Don't touch what you can't grab

End up with two backhands

Put anthrax on a Tampax

And slap you 'til you can't stand

Girl, you just blew your chance

Don't mean to ruin your plans



But I do know one thing though

Bitches, they come, they go

Saturday through Sunday, Monday

Monday through Sunday, yo

Maybe I'll love you one day

Maybe we'll someday grow

'Til then just sit your drunk ass on that fuckin' runway, ho



Cause I can't be your Superman

Can't be your Superman

Can't be your Superman

Can't be your Superman

I can't be your Superman

Can't be your Superman

Can't be your Superman

Your Superman, your Superman

I can't be your Superman

Can't be your Superman

Can't be your Superman

Can't be your Superman

I can't be your Superman

Can't be your Superman

Can't be your Superman

Your Superman, your Superman



I know you want me, baby, I think I want you too

(I think I love you, baby) I think I love you too

I'm here to save you, girl, come be in Shady's world

I wanna grow together, let's let our love unfurl

You know you want me, baby, you know I want you too

They call me Superman, I'm here to rescue you

I wanna save you, girl, come be in Shady's world

(Ooh boy, you drive me crazy) Bitch, you make me hurl



Cause I can't be your Superman

Can't be your Superman

Can't be your Superman

Can't be your Superman

I can't be your Superman

Can't be your Superman

Can't be your Superman

Your Superman, your Superman

I can't be your Superman

Can't be your Superman

Can't be your Superman

Can't be your Superman

I can't be your Superman

Can't be your Superman

Can't be your Superman

Your Superman, your Superman"
18-Feb-03,"""Just Drop Dead""",Limp Bizkit,Britney Spears,2003,
